{
  "capsule_id": "87654321-4321-8765-4321-876543218765",
  "created_at": "2026-09-24T02:06:00.000Z",
  "destination_cell_id": "cell_beta",
  "expires_at": "2026-09-24T03:00:00.000Z",
  "nonce": "abcdef0123456789",
  "prev_receipt_hash": "0000000000000000000000000000000000000000000000000000000000000000",
  "public_key": "4a5c89f0123456789abcdef0123456789abcdef0123456789abcdef012345678",
  "receipt_id": "11112222-3333-4444-5555-666677778888",
  "result_hash": "9f86d081884c7d659a2feaa0c55ad015a3bf4f1b2b0b822cd15d6c15b0f00a08",
  "schema": "sip.execution_receipt.v1",
  "sequence_number": 1,
  "signature": "c9839971489379872349872394872394872394872394872394872394872394872394872394872394872394872394872394872394872394872394872394872394",
  "source_cell_id": "cell_alpha",
  "state_hash": "cf23df2207d99a74fbe169e3eba035e633b65d947b0c407150033ad88f01bba2"
}